{
  "$schema": "./region-provider-support-matrix.schema.json",
  "schema_version": 1,
  "matrix_id": "phase0-real-estate-region",
  "as_of": "2026-08-03",
  "providers": [
    {
      "provider_id": "mois_jumin_statmonth_csv",
      "provider_contract_id": "mois_jumin_statmonth_csv",
      "source_kind": "official",
      "source_url": "https://jumin.mois.go.kr/",
      "official_available": true,
      "adapter_ready": true,
      "fixture_ready": true,
      "network_allowed": true,
      "projection_ready": true,
      "status": "pilot_ready",
      "geography_levels": ["sigungu"],
      "property_types": ["all"],
      "blocked_reason": null
    },
    {
      "provider_id": "reb_rone_public_table",
      "provider_contract_id": "reb_rone_public_table",
      "source_kind": "official",
      "source_url": "https://www.r-one.co.kr/",
      "official_available": true,
      "adapter_ready": false,
      "fixture_ready": true,
      "network_allowed": false,
      "projection_ready": false,
      "status": "blocked_coverage",
      "geography_levels": ["sigungu", "life_zone"],
      "property_types": ["apartment", "row_house", "detached_house"],
      "blocked_reason": "서울·부산의 동일 기간·동일 단위 fixture와 검토된 transport가 아직 없어 파서 seed로만 보존"
    },
    {
      "provider_id": "reb_stock",
      "provider_contract_id": "reb_stock",
      "source_kind": "official",
      "source_url": "https://www.data.go.kr/data/15106861/fileData.do",
      "official_available": true,
      "adapter_ready": false,
      "fixture_ready": true,
      "network_allowed": false,
      "projection_ready": false,
      "status": "blocked_fixture",
      "geography_levels": ["sigungu"],
      "property_types": ["apartment"],
      "blocked_reason": "seed fixture는 있으나 공식 다운로드 경로와 수정본 계약이 고정되지 않음"
    },
    {
      "provider_id": "molit_apt_sale",
      "provider_contract_id": "molit_apt_sale",
      "source_kind": "official",
      "source_url": "https://www.data.go.kr/data/15126469/openapi.do",
      "official_available": true,
      "adapter_ready": false,
      "fixture_ready": false,
      "network_allowed": false,
      "projection_ready": false,
      "status": "blocked_fixture",
      "geography_levels": ["sigungu"],
      "property_types": ["apartment"],
      "blocked_reason": "공식 요청·응답 fixture가 없어 실거래 비교자료를 추정하거나 투영하지 않음"
    },
    {
      "provider_id": "molit_apt_rent",
      "provider_contract_id": "molit_apt_rent",
      "source_kind": "official",
      "source_url": "https://www.data.go.kr/data/15126474/openapi.do",
      "official_available": true,
      "adapter_ready": false,
      "fixture_ready": false,
      "network_allowed": false,
      "projection_ready": false,
      "status": "blocked_fixture",
      "geography_levels": ["sigungu"],
      "property_types": ["apartment", "officetel"],
      "blocked_reason": "공식 요청·응답 fixture가 없어 임대 비교자료를 추정하거나 투영하지 않음"
    },
    {
      "provider_id": "reb_supply",
      "provider_contract_id": "reb_supply",
      "source_kind": "official",
      "source_url": "https://www.data.go.kr/data/15111714/fileData.do",
      "official_available": true,
      "adapter_ready": false,
      "fixture_ready": true,
      "network_allowed": false,
      "projection_ready": false,
      "status": "blocked_fixture",
      "geography_levels": ["sigungu"],
      "property_types": ["apartment"],
      "blocked_reason": "seed fixture는 있으나 공식 다운로드 경로와 수정본 계약이 고정되지 않음"
    },
    {
      "provider_id": "building_hub_housing_permit",
      "provider_contract_id": "building_hub_housing_permit",
      "source_kind": "official",
      "source_url": "https://www.data.go.kr/data/15044713/openapi.do",
      "official_available": true,
      "adapter_ready": false,
      "fixture_ready": false,
      "network_allowed": false,
      "projection_ready": false,
      "status": "blocked_fixture",
      "geography_levels": ["sigungu"],
      "property_types": ["apartment", "officetel", "row_house", "detached_house"],
      "blocked_reason": "건축 인허가 자료는 존재하지만 건축물대장 대상과의 식별자 매칭 fixture가 없음"
    },
    {
      "provider_id": "kapt_basic",
      "provider_contract_id": "kapt_basic",
      "source_kind": "official",
      "source_url": "https://www.k-apt.go.kr/",
      "official_available": true,
      "adapter_ready": false,
      "fixture_ready": false,
      "network_allowed": false,
      "projection_ready": false,
      "status": "blocked_fixture",
      "geography_levels": ["case", "sigungu"],
      "property_types": ["apartment"],
      "blocked_reason": "단지 식별자와 사건 주소를 연결하는 검증 fixture가 없음"
    },
    {
      "provider_id": "national_establishments",
      "provider_contract_id": "national_establishments",
      "source_kind": "official",
      "source_url": "https://www.data.go.kr/",
      "official_available": true,
      "adapter_ready": false,
      "fixture_ready": false,
      "network_allowed": false,
      "projection_ready": false,
      "status": "blocked_fixture",
      "geography_levels": ["sigungu"],
      "property_types": ["commercial", "office"],
      "blocked_reason": "상권·사업체 원문과 지역 지표의 정규화 fixture가 없음"
    },
    {
      "provider_id": "official_land_price_region",
      "provider_contract_id": "official_land_price_region",
      "source_kind": "official",
      "source_url": "https://www.data.go.kr/",
      "official_available": true,
      "adapter_ready": false,
      "fixture_ready": false,
      "network_allowed": false,
      "projection_ready": false,
      "status": "blocked_fixture",
      "geography_levels": ["sigungu"],
      "property_types": ["land"],
      "blocked_reason": "지역 단위 공시지가의 release·revision fixture가 없음"
    },
    {
      "provider_id": "official_land_price_case",
      "provider_contract_id": "official_land_price_case",
      "source_kind": "official",
      "source_url": "https://www.data.go.kr/",
      "official_available": true,
      "adapter_ready": false,
      "fixture_ready": false,
      "network_allowed": false,
      "projection_ready": false,
      "status": "blocked_fixture",
      "geography_levels": ["case", "sigungu"],
      "property_types": ["land", "apartment", "officetel"],
      "blocked_reason": "필지 식별자와 사건 대상 매칭 fixture가 없음"
    },
    {
      "provider_id": "housing_official_price",
      "provider_contract_id": null,
      "source_kind": "official",
      "source_url": "https://www.realtyprice.kr/",
      "official_available": true,
      "adapter_ready": false,
      "fixture_ready": false,
      "network_allowed": false,
      "projection_ready": false,
      "status": "blocked_fixture",
      "geography_levels": ["case", "sigungu"],
      "property_types": ["apartment", "officetel", "row_house", "detached_house"],
      "blocked_reason": "공동주택 공시가격 대상 식별과 revision fixture가 없음"
    },
    {
      "provider_id": "building_register",
      "provider_contract_id": null,
      "source_kind": "official",
      "source_url": "https://www.data.go.kr/",
      "official_available": true,
      "adapter_ready": false,
      "fixture_ready": false,
      "network_allowed": false,
      "projection_ready": false,
      "status": "blocked_fixture",
      "geography_levels": ["case"],
      "property_types": ["apartment", "officetel", "row_house", "detached_house", "commercial"],
      "blocked_reason": "건축물대장 원문과 경매 대상의 주소·동·호 매칭 fixture가 없음"
    },
    {
      "provider_id": "court_auction_notice",
      "provider_contract_id": null,
      "source_kind": "official",
      "source_url": "https://www.courtauction.go.kr/",
      "official_available": true,
      "adapter_ready": false,
      "fixture_ready": false,
      "network_allowed": false,
      "projection_ready": false,
      "status": "blocked_fixture",
      "geography_levels": ["case", "sigungu"],
      "property_types": ["all"],
      "blocked_reason": "사건번호·법원·매각 결과의 공식 응답 fixture가 없어 자동 낙찰 결과를 생성하지 않음"
    },
    {
      "provider_id": "admin_code",
      "provider_contract_id": "admin_code",
      "source_kind": "official",
      "source_url": "https://www.code.go.kr/",
      "official_available": true,
      "adapter_ready": false,
      "fixture_ready": false,
      "network_allowed": false,
      "projection_ready": false,
      "status": "blocked_fixture",
      "geography_levels": ["sido", "sigungu", "eup_myeon_dong"],
      "property_types": ["all"],
      "blocked_reason": "서울·부산의 행정구역 유효일과 변경 이력 fixture가 없음"
    }
  ]
}
